{
  "schema": "vrc-example-evidence/v1",
  "assessment_id": "SR-202",
  "target": {
    "repository": "trustoverip/dtgwg-cred-tf",
    "revision": "200acbaa47a422b173652ed2c3dc961c4fbc9e7a"
  },
  "source_manifest": "reassessed/source-manifest.json",
  "review_binding": {
    "path": "reassessed-review.yaml",
    "sha256": "b156cc51a358c36872358ae740b5ddfc0d84560cebb46161fe9e5c80425fb777"
  },
  "risks_binding": {
    "path": "data/risks.yaml",
    "sha256": "68a701afe5ed5163ee9fb377edff188f79d5305c91592e25d2ae663ceb2d089b"
  },
  "execution": {
    "state": "complete",
    "observations": {
      "general_vrc_zkp_requires_shared_community_evidence": false,
      "pairwise_zkp_section": true,
      "community_anchored_zkp_section": true,
      "explicit_no_shared_membership_precondition": true,
      "mdid_bootstrapping_residual": true
    }
  },
  "evidence": [
    {
      "id": "E-001",
      "source": "reassessed/source/dtg.md.txt",
      "section": "#### Pairwise Zero-Knowledge Proof",
      "contains": [
        "This construction is available to any two parties who hold a VRC between them, regardless of whether they share membership in a VTC."
      ]
    },
    {
      "id": "E-002",
      "source": "reassessed/source/dtg.md.txt",
      "section": "#### Community-Anchored Zero-Knowledge Proof",
      "contains": [
        "Community membership is **not** a precondition for issuing, holding, or presenting a VRC",
        "When both parties to a VRC hold VMCs from the same community"
      ]
    },
    {
      "id": "E-003",
      "source": "reassessed/source/dtg.md.txt",
      "section": "### Privacy Considerations",
      "contains": [
        "**M-DID reuse:** Allowed for bootstrapping",
        "Migration from M-DID-based to R-DID-based edges recommended post-bootstrapping for enhanced privacy."
      ]
    }
  ],
  "findings": [
    {
      "id": "F-001",
      "evidence": [
        "E-001",
        "E-002"
      ],
      "observation": "The revised source defines a pairwise VRC proof independent of shared-community membership and a separate community-anchored proof for parties sharing a VTC.",
      "inference": "The source now distinguishes general relationship proof from community-derived assurance, resolving the documentary interpretation gap identified in SR-201.",
      "limitations": [
        "Resolution is limited to the specification text. No implementation interoperability or cryptographic proof construction was independently validated."
      ],
      "treatment": "Retain the pairwise/community-anchored distinction and test implementations separately when executable ZKP profiles become available.",
      "risk_reasoning": {
        "RK-SC02": "The revised text removes the specific ambiguity about whether shared-community membership is required for all VRC proofs; broader credential interoperability remains outside this finding."
      }
    },
    {
      "id": "F-002",
      "evidence": [
        "E-003"
      ],
      "observation": "The M-DID bootstrapping and recommended post-bootstrapping migration text is unchanged in the reassessed revision.",
      "inference": "The source change does not close the residual linkability window because migration remains recommended rather than triggered by a normative condition.",
      "limitations": [
        "No deployed registry, governance policy or actual migration behavior was examined, so operational treatment may exist outside this specification."
      ],
      "treatment": "Keep the residual issue open until a normative or governance-controlled migration trigger is evidenced.",
      "risk_reasoning": {
        "RK-ID05": "The maintained risk continues to apply because the reassessed source retains the same M-DID bootstrapping exception and non-normative migration language."
      }
    }
  ],
  "method_revision": "8c6bda78f477b109d07acf62c38599c4887f6d38"
}
